{
  "$schema": "http://json-schema.org/draft-07/schema#",
  "$comment": "GENERATED by gui/schema-gen/derive_nf_config_schemas.py from config/ausf.json + its source (ADR-0425). Do not edit; regenerate.",
  "title": "ausf",
  "type": "object",
  "additionalProperties": false,
  "properties": {
    "port": {
      "type": "integer",
      "x-cpp-type": "unsigned short"
    },
    "sbi_bind_address": {
      "type": "string",
      "x-cpp-type": "std::string"
    },
    "advertised_ipv4": {
      "type": "string",
      "x-env-override": "AUSF_ADVERTISED_IPV4",
      "x-cpp-type": "std::string"
    },
    "metrics_bind_address": {
      "type": "string",
      "x-cpp-type": "std::string"
    },
    "nrf_base_url": {
      "type": "string",
      "x-env-override": "AUSF_NRF_BASE_URL",
      "x-cpp-type": "std::string"
    },
    "udm_base_url": {
      "type": "string",
      "x-env-override": "AUSF_UDM_BASE_URL",
      "x-cpp-type": "std::string"
    },
    "redis_url": {
      "type": "string",
      "x-env-override": "AUSF_REDIS_URL",
      "x-cpp-type": "std::string"
    },
    "akma": {
      "type": "object",
      "additionalProperties": false,
      "properties": {
        "aanf_base_url": {
          "type": "string"
        },
        "home_mcc": {
          "type": "string"
        },
        "home_mnc": {
          "type": "string"
        }
      }
    },
    "oauth2_required": {
      "type": "boolean",
      "x-env-override": "AUSF_OAUTH2_REQUIRED",
      "x-cpp-type": "bool"
    }
  },
  "required": [
    "advertised_ipv4",
    "metrics_bind_address",
    "nrf_base_url",
    "port",
    "redis_url",
    "sbi_bind_address",
    "udm_base_url"
  ],
  "x-config-file": "config/ausf.json",
  "x-source": [
    "nfs/ausf"
  ],
  "x-apply": "restart",
  "x-review": [
    "akma: nested object shape inferred from current values (map-vs-struct meaning unverified; new keys refused until reviewed)"
  ]
}
